Match: all_games_1367856_1384438.json
Balls faced: 1
Bowler: Cummins
Over: 44
Pitch Line: OUTSIDE_OFFSTUMP Length: GOOD_LENGTH
Shot: DEFENDED
Run scored: 0


full and straight, defended


Balls faced: 2
Bowler: Cummins
Over: 44
Pitch Line: OUTSIDE_OFFSTUMP Length: SHORT_OF_A_GOOD_LENGTH
Shot: FLICK
Run scored: 1


short of a length, tucked off the hip into the leg side


Balls faced: 3
Bowler: Zampa
Over: 45
Pitch Line: OUTSIDE_OFFSTUMP Length: GOOD_LENGTH
Shot: CUT_SHOT
Run scored: 1


touch short outside off, square cuts to deep cover...again Zampa escapes without major damage
Interesting call from Cummins to use Zampa. The result will likely dictate how much it is debated

Balls faced: 4
Bowler: Zampa
Over: 45
Pitch Line: OUTSIDE_OFFSTUMP Length: GOOD_LENGTH
Shot: PUSH
Run scored: 0


plays back and defends to the off side


Balls faced: 5
Bowler: Cummins
Over: 44
Pitch Line: OUTSIDE_OFFSTUMP Length: GOOD_LENGTH
Shot: DEFENDED
Run scored: 0


full and straight, defended


Balls faced: 6
Bowler: Cummins
Over: 44
Pitch Line: OUTSIDE_OFFSTUMP Length: SHORT_OF_A_GOOD_LENGTH
Shot: FLICK
Run scored: 1


short of a length, tucked off the hip into the leg side


Balls faced: 7
Bowler: Cummins
Over: 46
Pitch Line: OUTSIDE_OFFSTUMP Length: SHORT_OF_A_GOOD_LENGTH
Shot: DAB
Run scored: 1


a slower ball on a length, it grips, tapped into the off side and he's called through
asad: "Miller likes pace that's why" - Likes Zampa, too

Balls faced: 8
Bowler: Cummins
Over: 46
Pitch Line: OUTSIDE_OFFSTUMP Length: SHORT
Shot: LEFT_ALONE
Run scored: 0


sways out of the way of a straight bouncer


Balls faced: 9
Bowler: Cummins
Over: 46
Pitch Line: OUTSIDE_OFFSTUMP Length: SHORT_OF_A_GOOD_LENGTH
Shot: DAB
Run scored: 1


squared up on the back foot, but the ball rolls into space on the off side


Balls faced: 10
Bowler: Zampa
Over: 45
Pitch Line: OUTSIDE_OFFSTUMP Length: GOOD_LENGTH
Shot: CUT_SHOT
Run scored: 1


touch short outside off, square cuts to deep cover...again Zampa escapes without major damage
Interesting call from Cummins to use Zampa. The result will likely dictate how much it is debated

Balls faced: 11
Bowler: Zampa
Over: 45
Pitch Line: OUTSIDE_OFFSTUMP Length: GOOD_LENGTH
Shot: PUSH
Run scored: 0


plays back and defends to the off side


Balls faced: 12
Bowler: Starc
Over: 47
Pitch Line: WIDE_OUTSIDE_OFFSTUMP Length: FULL
Shot: ON_DRIVE
Run scored: 0

Maharaj is OUT! caught
c Smith b Starc
Keshav Maharaj c Smith b Starc 4 (8b 0x4 0x6 13m) SR: 50
round the wicket, full outside off, carved high into the air and taken on the edge of the ring by mid-off. Comes off the toe of the bat. Maybe not the smartest stroke
Miller risks being left stranded. If he gets back on strike, may not be able to take singles

Balls faced: 13
Bowler: Cummins
Over: 46
Pitch Line: OUTSIDE_OFFSTUMP Length: SHORT_OF_A_GOOD_LENGTH
Shot: DAB
Run scored: 1


a slower ball on a length, it grips, tapped into the off side and he's called through
asad: "Miller likes pace that's why" - Likes Zampa, too

Balls faced: 14
Bowler: Cummins
Over: 46
Pitch Line: OUTSIDE_OFFSTUMP Length: SHORT
Shot: LEFT_ALONE
Run scored: 0


sways out of the way of a straight bouncer


Balls faced: 15
Bowler: Cummins
Over: 46
Pitch Line: OUTSIDE_OFFSTUMP Length: SHORT_OF_A_GOOD_LENGTH
Shot: DAB
Run scored: 1


squared up on the back foot, but the ball rolls into space on the off side


Balls faced: 16
Bowler: Starc
Over: 47
Pitch Line: WIDE_OUTSIDE_OFFSTUMP Length: FULL
Shot: ON_DRIVE
Run scored: 0

Maharaj is OUT! caught
c Smith b Starc
Keshav Maharaj c Smith b Starc 4 (8b 0x4 0x6 13m) SR: 50
round the wicket, full outside off, carved high into the air and taken on the edge of the ring by mid-off. Comes off the toe of the bat. Maybe not the smartest stroke
Miller risks being left stranded. If he gets back on strike, may not be able to take singles


Match: all_games_1387592_1387599.json
Balls faced: 1
Bowler: Kuldeep
Over: 12
Pitch Line: ON_THE_STUMPS Length: GOOD_LENGTH
Shot: DEFENDED
Run scored: 0

Maharaj is OUT! bowled
 b Kuldeep Yadav
Keshav Maharaj b Kuldeep Yadav 1 (3b 0x4 0x6 5m) SR: 33.33
stays low, and Kuldeep is on target. On a length, middle and off, and it turns in and stays low to beat the toe of his bat


Balls faced: 2
Bowler: Kuldeep
Over: 12
Pitch Line: OUTSIDE_OFFSTUMP Length: GOOD_LENGTH
Shot: CUT_SHOT
Run scored: 0


pushes this through but stays full. Maharaj sees the trajectory and stays back. Beaten


Balls faced: 3
Bowler: Kuldeep
Over: 12
Pitch Line: OUTSIDE_OFFSTUMP Length: GOOD_LENGTH
Shot: COVER_DRIVE
Run scored: 1


on a length, slow in the air, no turn, pushed to deep cover


Balls faced: 4
Bowler: Kuldeep
Over: 12
Pitch Line: ON_THE_STUMPS Length: GOOD_LENGTH
Shot: DEFENDED
Run scored: 0

Maharaj is OUT! bowled
 b Kuldeep Yadav
Keshav Maharaj b Kuldeep Yadav 1 (3b 0x4 0x6 5m) SR: 33.33
stays low, and Kuldeep is on target. On a length, middle and off, and it turns in and stays low to beat the toe of his bat


Balls faced: 5
Bowler: Kuldeep
Over: 12
Pitch Line: OUTSIDE_OFFSTUMP Length: GOOD_LENGTH
Shot: CUT_SHOT
Run scored: 0


pushes this through but stays full. Maharaj sees the trajectory and stays back. Beaten


Balls faced: 6
Bowler: Kuldeep
Over: 12
Pitch Line: OUTSIDE_OFFSTUMP Length: GOOD_LENGTH
Shot: COVER_DRIVE
Run scored: 1


on a length, slow in the air, no turn, pushed to deep cover



Match: all_games_1387592_1387600.json
Balls faced: 1
Bowler: Avesh Khan
Over: 15
Pitch Line: OUTSIDE_OFFSTUMP Length: GOOD_LENGTH
Shot: LEFT_ALONE
Run scored: 0


stays on a good length, defended outside off
For the next little bit, I leave you in the able hands of Sreshth

Balls faced: 2
Bowler: Avesh Khan
Over: 15
Pitch Line: OUTSIDE_OFFSTUMP Length: GOOD_LENGTH
Shot: COVER_DRIVE
Run scored: 0


still appreciable seam movement. Maharaj pushes at a length ball, and is <b>lucky not to edge it</b> as it seams away


Balls faced: 3
Bowler: Avesh Khan
Over: 15
Pitch Line: ON_THE_STUMPS Length: SHORT
Shot: LEFT_ALONE
Run scored: 0


bouncer, just outside off, and Maharaj sways out of its line


Balls faced: 4
Bowler: Avesh Khan
Over: 15
Pitch Line: ON_THE_STUMPS Length: GOOD_LENGTH
Shot: DEFENDED
Run scored: 0


full, just outside off, seams in to hit the inner half of the bat


Balls faced: 5
Bowler: Avesh Khan
Over: 15
Pitch Line: ON_THE_STUMPS Length: SHORT
Shot: LEFT_ALONE
Run scored: 0


wide down the leg side. Loses his line completely

Wide: 1
Balls faced: 6
Bowler: Avesh Khan
Over: 15
Pitch Line: OUTSIDE_OFFSTUMP Length: GOOD_LENGTH
Shot: COVER_DRIVE
Run scored: 4


lovely shot. Back-foot drive. Punched through cover-point for four. Superb hands there


Balls faced: 7
Bowler: Avesh Khan
Over: 15
Pitch Line: OUTSIDE_OFFSTUMP Length: SHORT_OF_A_GOOD_LENGTH
Shot: LEFT_ALONE
Run scored: 0
Keshav Maharaj is the new batter. Avesh continues

it is still nipping around. Left alone outside off, and it seams away


Balls faced: 8
Bowler: Avesh Khan
Over: 15
Pitch Line: OUTSIDE_OFFSTUMP Length: GOOD_LENGTH
Shot: LEFT_ALONE
Run scored: 0


stays on a good length, defended outside off
For the next little bit, I leave you in the able hands of Sreshth

Balls faced: 9
Bowler: Avesh Khan
Over: 15
Pitch Line: OUTSIDE_OFFSTUMP Length: GOOD_LENGTH
Shot: COVER_DRIVE
Run scored: 0


still appreciable seam movement. Maharaj pushes at a length ball, and is <b>lucky not to edge it</b> as it seams away


Balls faced: 10
Bowler: Avesh Khan
Over: 15
Pitch Line: ON_THE_STUMPS Length: SHORT
Shot: LEFT_ALONE
Run scored: 0


bouncer, just outside off, and Maharaj sways out of its line


Balls faced: 11
Bowler: Avesh Khan
Over: 15
Pitch Line: ON_THE_STUMPS Length: GOOD_LENGTH
Shot: DEFENDED
Run scored: 0


full, just outside off, seams in to hit the inner half of the bat


Balls faced: 12
Bowler: Avesh Khan
Over: 15
Pitch Line: ON_THE_STUMPS Length: SHORT
Shot: LEFT_ALONE
Run scored: 0


wide down the leg side. Loses his line completely

Wide: 1
Balls faced: 13
Bowler: Avesh Khan
Over: 15
Pitch Line: OUTSIDE_OFFSTUMP Length: GOOD_LENGTH
Shot: COVER_DRIVE
Run scored: 4


lovely shot. Back-foot drive. Punched through cover-point for four. Superb hands there


Balls faced: 14
Bowler: Avesh Khan
Over: 15
Pitch Line: OUTSIDE_OFFSTUMP Length: SHORT_OF_A_GOOD_LENGTH
Shot: LEFT_ALONE
Run scored: 0
Keshav Maharaj is the new batter. Avesh continues

it is still nipping around. Left alone outside off, and it seams away


Balls faced: 15
Bowler: Avesh Khan
Over: 17
Pitch Line: OUTSIDE_OFFSTUMP Length: GOOD_LENGTH
Shot: COVER_DRIVE
Run scored: 0

Maharaj is OUT! caught
c Gaikwad b Avesh Khan
Keshav Maharaj c Gaikwad b Avesh Khan 4 (7b 1x4 0x6 17m) SR: 57.14
<B>four for Avesh too!</b> Short of length ball outside off. Maharaj looks to play on the up,  and the attempted flay over the off side has been mistimed. Short cover with a simple one


Balls faced: 16
Bowler: Avesh Khan
Over: 17
Pitch Line: OUTSIDE_OFFSTUMP Length: GOOD_LENGTH
Shot: COVER_DRIVE
Run scored: 0

Maharaj is OUT! caught
c Gaikwad b Avesh Khan
Keshav Maharaj c Gaikwad b Avesh Khan 4 (7b 1x4 0x6 17m) SR: 57.14
<B>four for Avesh too!</b> Short of length ball outside off. Maharaj looks to play on the up,  and the attempted flay over the off side has been mistimed. Short cover with a simple one



Match: all_games_1387592_1387602.json
Balls faced: 1
Bowler: Sundar
Over: 34
Pitch Line: ON_THE_STUMPS Length: GOOD_LENGTH
Shot: PUSH
Run scored: 1


worked to the leg side for a single


Balls faced: 2
Bowler: Sundar
Over: 34
Pitch Line: OUTSIDE_OFFSTUMP Length: FULL
Shot: COVER_DRIVE
Run scored: 2


full ball outside off. Driven to deep extra cover for a couple
Shubham: "3 wickets in last 23 balls has turned the game in Ind's favour. 2 of those coming by DRS " -- yes indeed. Two overturned decisions is a lot!

Balls faced: 3
Bowler: Avesh Khan
Over: 35
Pitch Line: OUTSIDE_OFFSTUMP Length: GOOD_LENGTH
Shot: SQUARE_DRIVE
Run scored: 1


full and wide outside off stump. Driven away from his body to deep extra cover
Sohum T: "SA need not panic till D Miller is out there. Conversely, India cannot breath easy till he is out there."

Balls faced: 4
Bowler: Avesh Khan
Over: 35
Pitch Line: DOWN_LEG Length: GOOD_LENGTH
Shot: LEG_GLANCE
Run scored: 0


full ball outside leg stump.

Wide: 1
Balls faced: 5
Bowler: Avesh Khan
Over: 35
Pitch Line: OUTSIDE_OFFSTUMP Length: SHORT_OF_A_GOOD_LENGTH
Shot: CUT_SHOT
Run scored: 1


length ball, with width. Cut square for a single


Balls faced: 6
Bowler: Sundar
Over: 34
Pitch Line: ON_THE_STUMPS Length: GOOD_LENGTH
Shot: PUSH
Run scored: 1


worked to the leg side for a single


Balls faced: 7
Bowler: Sundar
Over: 34
Pitch Line: OUTSIDE_OFFSTUMP Length: FULL
Shot: COVER_DRIVE
Run scored: 2


full ball outside off. Driven to deep extra cover for a couple
Shubham: "3 wickets in last 23 balls has turned the game in Ind's favour. 2 of those coming by DRS " -- yes indeed. Two overturned decisions is a lot!

Balls faced: 8
Bowler: Sundar
Over: 36
Pitch Line: OUTSIDE_OFFSTUMP Length: GOOD_LENGTH
Shot: DEFENDED
Run scored: 1


full ball on off. Tries to fend. Takes the outside edge and he's lucky there's no slip fielder present


Balls faced: 9
Bowler: Sundar
Over: 36
Pitch Line: OUTSIDE_OFFSTUMP Length: GOOD_LENGTH
Shot: DEFENDED
Run scored: 0


full ball around off stump. Defended


Balls faced: 10
Bowler: Sundar
Over: 36
Pitch Line: OUTSIDE_OFFSTUMP Length: GOOD_LENGTH
Shot: DEFENDED
Run scored: 0


good length ball outside off. Turning in. Mistimes the cut. Ball rolls leg side


Balls faced: 11
Bowler: Sundar
Over: 36
Pitch Line: OUTSIDE_OFFSTUMP Length: GOOD_LENGTH
Shot: DEFENDED
Run scored: 0


full ball just outside off. Fended towards cover


Balls faced: 12
Bowler: Sundar
Over: 36
Pitch Line: OUTSIDE_OFFSTUMP Length: GOOD_LENGTH
Shot: DEFENDED
Run scored: 0


full on off. Fended off the back foot


Balls faced: 13
Bowler: Avesh Khan
Over: 35
Pitch Line: OUTSIDE_OFFSTUMP Length: GOOD_LENGTH
Shot: SQUARE_DRIVE
Run scored: 1


full and wide outside off stump. Driven away from his body to deep extra cover
Sohum T: "SA need not panic till D Miller is out there. Conversely, India cannot breath easy till he is out there."

Balls faced: 14
Bowler: Avesh Khan
Over: 35
Pitch Line: DOWN_LEG Length: GOOD_LENGTH
Shot: LEG_GLANCE
Run scored: 0


full ball outside leg stump.

Wide: 1
Balls faced: 15
Bowler: Avesh Khan
Over: 35
Pitch Line: OUTSIDE_OFFSTUMP Length: SHORT_OF_A_GOOD_LENGTH
Shot: CUT_SHOT
Run scored: 1


length ball, with width. Cut square for a single


Balls faced: 16
Bowler: Avesh Khan
Over: 37
Pitch Line: OUTSIDE_OFFSTUMP Length: SHORT_OF_A_GOOD_LENGTH
Shot: COVER_DRIVE
Run scored: 1


punched to mid-off where Sudharsan puts in a dive to cut that off


Balls faced: 17
Bowler: Avesh Khan
Over: 37
Pitch Line: OUTSIDE_OFFSTUMP Length: FULL_TOSS
Shot: PUSH
Run scored: 0


hits this full toss straight to cover. Pressure builds.


Balls faced: 18
Bowler: Avesh Khan
Over: 37
Pitch Line: OUTSIDE_OFFSTUMP Length: SHORT
Shot: LEFT_ALONE
Run scored: 0


dug in outside off, Maharaj looks to cut but bails out of it in the end


Balls faced: 19
Bowler: Avesh Khan
Over: 37
Pitch Line: OUTSIDE_OFFSTUMP Length: GOOD_LENGTH
Shot: PUSH
Run scored: 1


slower and fuller outside off, pushed past cover


Balls faced: 20
Bowler: Avesh Khan
Over: 37
Pitch Line: OUTSIDE_OFFSTUMP Length: FULL
Shot: COVER_DRIVE
Run scored: 0


into the blockhole, dug out


Balls faced: 21
Bowler: Sundar
Over: 36
Pitch Line: OUTSIDE_OFFSTUMP Length: GOOD_LENGTH
Shot: DEFENDED
Run scored: 1


full ball on off. Tries to fend. Takes the outside edge and he's lucky there's no slip fielder present


Balls faced: 22
Bowler: Sundar
Over: 36
Pitch Line: OUTSIDE_OFFSTUMP Length: GOOD_LENGTH
Shot: DEFENDED
Run scored: 0


full ball around off stump. Defended


Balls faced: 23
Bowler: Sundar
Over: 36
Pitch Line: OUTSIDE_OFFSTUMP Length: GOOD_LENGTH
Shot: DEFENDED
Run scored: 0


good length ball outside off. Turning in. Mistimes the cut. Ball rolls leg side


Balls faced: 24
Bowler: Sundar
Over: 36
Pitch Line: OUTSIDE_OFFSTUMP Length: GOOD_LENGTH
Shot: DEFENDED
Run scored: 0


full ball just outside off. Fended towards cover


Balls faced: 25
Bowler: Sundar
Over: 36
Pitch Line: OUTSIDE_OFFSTUMP Length: GOOD_LENGTH
Shot: DEFENDED
Run scored: 0


full on off. Fended off the back foot


Balls faced: 26
Bowler: Mukesh Kumar
Over: 38
Pitch Line: OUTSIDE_OFFSTUMP Length: GOOD_LENGTH
Shot: STEERED
Run scored: 1


slashed to square third


Balls faced: 27
Bowler: Mukesh Kumar
Over: 38
Pitch Line: OUTSIDE_OFFSTUMP Length: FULL
Shot: COVER_DRIVE
Run scored: 0
Mukesh back

full and moving away a hint from outside off, Maharaj beaten as he tries to thrash that over cover


Balls faced: 28
Bowler: Avesh Khan
Over: 37
Pitch Line: OUTSIDE_OFFSTUMP Length: SHORT_OF_A_GOOD_LENGTH
Shot: COVER_DRIVE
Run scored: 1


punched to mid-off where Sudharsan puts in a dive to cut that off


Balls faced: 29
Bowler: Avesh Khan
Over: 37
Pitch Line: OUTSIDE_OFFSTUMP Length: FULL_TOSS
Shot: PUSH
Run scored: 0


hits this full toss straight to cover. Pressure builds.


Balls faced: 30
Bowler: Avesh Khan
Over: 37
Pitch Line: OUTSIDE_OFFSTUMP Length: SHORT
Shot: LEFT_ALONE
Run scored: 0


dug in outside off, Maharaj looks to cut but bails out of it in the end


Balls faced: 31
Bowler: Avesh Khan
Over: 37
Pitch Line: OUTSIDE_OFFSTUMP Length: GOOD_LENGTH
Shot: PUSH
Run scored: 1


slower and fuller outside off, pushed past cover


Balls faced: 32
Bowler: Avesh Khan
Over: 37
Pitch Line: OUTSIDE_OFFSTUMP Length: FULL
Shot: COVER_DRIVE
Run scored: 0


into the blockhole, dug out


Balls faced: 33
Bowler: Axar Patel
Over: 39
Pitch Line: OUTSIDE_OFFSTUMP Length: FULL
Shot: ON_DRIVE
Run scored: 1


lofted, one bounce to long-off.


Balls faced: 34
Bowler: Axar Patel
Over: 39
Pitch Line: OUTSIDE_OFFSTUMP Length: SHORT_OF_A_GOOD_LENGTH
Shot: DEFENDED
Run scored: 0


quicker one on a length, defended


Balls faced: 35
Bowler: Axar Patel
Over: 39
Pitch Line: OUTSIDE_OFFSTUMP Length: FULL
Shot: COVER_DRIVE
Run scored: 1


driven inside-out to deep cover


Balls faced: 36
Bowler: Mukesh Kumar
Over: 38
Pitch Line: OUTSIDE_OFFSTUMP Length: GOOD_LENGTH
Shot: STEERED
Run scored: 1


slashed to square third


Balls faced: 37
Bowler: Mukesh Kumar
Over: 38
Pitch Line: OUTSIDE_OFFSTUMP Length: FULL
Shot: COVER_DRIVE
Run scored: 0
Mukesh back

full and moving away a hint from outside off, Maharaj beaten as he tries to thrash that over cover


Balls faced: 38
Bowler: Mukesh Kumar
Over: 40
Pitch Line: OUTSIDE_OFFSTUMP Length: GOOD_LENGTH
Shot: COVER_DRIVE
Run scored: 1


flays the drive to sweeper cover


Balls faced: 39
Bowler: Axar Patel
Over: 39
Pitch Line: OUTSIDE_OFFSTUMP Length: FULL
Shot: ON_DRIVE
Run scored: 1


lofted, one bounce to long-off.


Balls faced: 40
Bowler: Axar Patel
Over: 39
Pitch Line: OUTSIDE_OFFSTUMP Length: SHORT_OF_A_GOOD_LENGTH
Shot: DEFENDED
Run scored: 0


quicker one on a length, defended


Balls faced: 41
Bowler: Axar Patel
Over: 39
Pitch Line: OUTSIDE_OFFSTUMP Length: FULL
Shot: COVER_DRIVE
Run scored: 1


driven inside-out to deep cover


Balls faced: 42
Bowler: Axar Patel
Over: 41
Pitch Line: OUTSIDE_OFFSTUMP Length: SHORT_OF_A_GOOD_LENGTH
Shot: DEFENDED
Run scored: 0


defends this quick-arm delivery once again


Balls faced: 43
Bowler: Axar Patel
Over: 41
Pitch Line: OUTSIDE_OFFSTUMP Length: SHORT_OF_A_GOOD_LENGTH
Shot: CUT_SHOT
Run scored: 0


pad first and that's given by Ahsan Raza. Axar's arm ball and the fizz off the pitch has done the trick. Or has it? South Africa have reviewed. Looks like impact was outside off. So the original decision will need to be overturned. Maharaj was shaping to cut but realised the ball simply skid through to hit the pad before it made contact with the bat.


Balls faced: 44
Bowler: Axar Patel
Over: 41
Pitch Line: OUTSIDE_OFFSTUMP Length: GOOD_LENGTH
Shot: DEFENDED
Run scored: 0


gets right behind the line of this arm ball as he defends


Balls faced: 45
Bowler: Axar Patel
Over: 41
Pitch Line: ON_THE_STUMPS Length: FULL
Shot: DEFENDED
Run scored: 0


plays back to a length ball that drifts in and skids through, defends it somehow


Balls faced: 46
Bowler: Axar Patel
Over: 41
Pitch Line: OUTSIDE_OFFSTUMP Length: GOOD_LENGTH
Shot: PUSH
Run scored: 1


plays back to a full'ish delivery, squirts off the inside edge into the leg side


Balls faced: 47
Bowler: Mukesh Kumar
Over: 40
Pitch Line: OUTSIDE_OFFSTUMP Length: GOOD_LENGTH
Shot: COVER_DRIVE
Run scored: 1


flays the drive to sweeper cover


Balls faced: 48
Bowler: Axar Patel
Over: 41
Pitch Line: OUTSIDE_OFFSTUMP Length: SHORT_OF_A_GOOD_LENGTH
Shot: DEFENDED
Run scored: 0


defends this quick-arm delivery once again


Balls faced: 49
Bowler: Axar Patel
Over: 41
Pitch Line: OUTSIDE_OFFSTUMP Length: SHORT_OF_A_GOOD_LENGTH
Shot: CUT_SHOT
Run scored: 0


pad first and that's given by Ahsan Raza. Axar's arm ball and the fizz off the pitch has done the trick. Or has it? South Africa have reviewed. Looks like impact was outside off. So the original decision will need to be overturned. Maharaj was shaping to cut but realised the ball simply skid through to hit the pad before it made contact with the bat.


Balls faced: 50
Bowler: Axar Patel
Over: 41
Pitch Line: OUTSIDE_OFFSTUMP Length: GOOD_LENGTH
Shot: DEFENDED
Run scored: 0


gets right behind the line of this arm ball as he defends


Balls faced: 51
Bowler: Axar Patel
Over: 41
Pitch Line: ON_THE_STUMPS Length: FULL
Shot: DEFENDED
Run scored: 0


plays back to a length ball that drifts in and skids through, defends it somehow


Balls faced: 52
Bowler: Axar Patel
Over: 41
Pitch Line: OUTSIDE_OFFSTUMP Length: GOOD_LENGTH
Shot: PUSH
Run scored: 1


plays back to a full'ish delivery, squirts off the inside edge into the leg side


Balls faced: 53
Bowler: Arshdeep Singh
Over: 43
Pitch Line: ON_THE_STUMPS Length: SHORT_OF_A_GOOD_LENGTH
Shot: PULL
Run scored: 0

Maharaj is OUT! caught
c Singh b Arshdeep Singh
Keshav Maharaj c Singh b Arshdeep Singh 14 (27b 0x4 0x6 43m) SR: 51.85
picks out Rinku at deep square! Arshdeep's change of pace works. Bowls one into the pitch, takes pace off and Maharaj ends up dragging it from outside off to the man in the deep.


Balls faced: 54
Bowler: Arshdeep Singh
Over: 43
Pitch Line: ON_THE_STUMPS Length: SHORT_OF_A_GOOD_LENGTH
Shot: CUT_SHOT
Run scored: 1
Arshdeep back

steered past point


Balls faced: 55
Bowler: Arshdeep Singh
Over: 43
Pitch Line: ON_THE_STUMPS Length: SHORT_OF_A_GOOD_LENGTH
Shot: PULL
Run scored: 0

Maharaj is OUT! caught
c Singh b Arshdeep Singh
Keshav Maharaj c Singh b Arshdeep Singh 14 (27b 0x4 0x6 43m) SR: 51.85
picks out Rinku at deep square! Arshdeep's change of pace works. Bowls one into the pitch, takes pace off and Maharaj ends up dragging it from outside off to the man in the deep.


Balls faced: 56
Bowler: Arshdeep Singh
Over: 43
Pitch Line: ON_THE_STUMPS Length: SHORT_OF_A_GOOD_LENGTH
Shot: CUT_SHOT
Run scored: 1
Arshdeep back

steered past point



Match: all_games_1387592_1387604.json
Balls faced: 1
Bowler: Siraj
Over: 16
Pitch Line: OUTSIDE_OFFSTUMP Length: GOOD_LENGTH
Shot: DEFENDED
Run scored: 0
Keshav Maharaj now

length ball around off. Defended. A double-wicket maiden for Siraj. He has figures of 5 for 9 after eight overs. Will he get another over in this spell?


Balls faced: 2
Bowler: Prasidh
Over: 17
Pitch Line: OUTSIDE_OFFSTUMP Length: SHORT_OF_A_GOOD_LENGTH
Shot: DEFENDED
Run scored: 0


extra bounce for Prasidh. Managed safely by Maharaj
Gana: "Need to bring back Bumrah here. Prasiddh seems to be leaking runs here. Need to wrap up SA cheaply. "

Balls faced: 3
Bowler: Prasidh
Over: 17
Pitch Line: OUTSIDE_OFFSTUMP Length: FULL
Shot: ON_DRIVE
Run scored: 3


length ball around off. Pushed down the ground through the vacant mid-off region. Rohit puts in the chase


Balls faced: 4
Bowler: Prasidh
Over: 17
Pitch Line: OUTSIDE_OFFSTUMP Length: GOOD_LENGTH
Shot: DEFENDED
Run scored: 0


length ball around off. Comes forward and defends it towards covers
vikram Chandra: "I just came back from lunch to see after knowing SA batting first and now just seeing the carnage on TV. "

Balls faced: 5
Bowler: Siraj
Over: 16
Pitch Line: OUTSIDE_OFFSTUMP Length: GOOD_LENGTH
Shot: DEFENDED
Run scored: 0
Keshav Maharaj now

length ball around off. Defended. A double-wicket maiden for Siraj. He has figures of 5 for 9 after eight overs. Will he get another over in this spell?


Balls faced: 6
Bowler: Prasidh
Over: 17
Pitch Line: OUTSIDE_OFFSTUMP Length: SHORT_OF_A_GOOD_LENGTH
Shot: DEFENDED
Run scored: 0


extra bounce for Prasidh. Managed safely by Maharaj
Gana: "Need to bring back Bumrah here. Prasiddh seems to be leaking runs here. Need to wrap up SA cheaply. "

Balls faced: 7
Bowler: Prasidh
Over: 17
Pitch Line: OUTSIDE_OFFSTUMP Length: FULL
Shot: ON_DRIVE
Run scored: 3


length ball around off. Pushed down the ground through the vacant mid-off region. Rohit puts in the chase


Balls faced: 8
Bowler: Prasidh
Over: 17
Pitch Line: OUTSIDE_OFFSTUMP Length: GOOD_LENGTH
Shot: DEFENDED
Run scored: 0


length ball around off. Comes forward and defends it towards covers
vikram Chandra: "I just came back from lunch to see after knowing SA batting first and now just seeing the carnage on TV. "

Balls faced: 9
Bowler: Prasidh
Over: 19
Pitch Line: ON_THE_STUMPS Length: GOOD_LENGTH
Shot: FLICK
Run scored: 0


short of length at the batter. Maharaj manages to dab it down behind square leg for one

Legbyes: 1
Balls faced: 10
Bowler: Prasidh
Over: 19
Pitch Line: OUTSIDE_OFFSTUMP Length: SHORT
Shot: PULL
Run scored: 0


a bouncer, angling towards the batter's head. Maharaj goes for the pull but misses


Balls faced: 11
Bowler: Prasidh
Over: 19
Pitch Line: OUTSIDE_OFFSTUMP Length: GOOD_LENGTH
Shot: DEFENDED
Run scored: 0


length ball around off. Defended


Balls faced: 12
Bowler: Mukesh Kumar
Over: 20
Pitch Line: OUTSIDE_OFFSTUMP Length: SHORT_OF_A_GOOD_LENGTH
Shot: PULL
Run scored: 0

Maharaj is OUT! caught
c Bumrah b Mukesh Kumar
Keshav Maharaj c Bumrah b Mukesh Kumar 3 (13b 0x4 0x6 20m) SR: 23.07
<b>Mukesh strikes in his first over.</b> A length ball around off, and Maharaj goes for the pull. But the ball hits high on the bat and lobs towards midwicket where Bumrah accepts the dolly. <b>South Africa 46 for 8</b>


Balls faced: 13
Bowler: Mukesh Kumar
Over: 20
Pitch Line: OUTSIDE_OFFSTUMP Length: GOOD_LENGTH
Shot: SQUARE_DRIVE
Run scored: 0


full around off. Driven towards backward point where Jadeja makes a diving stop to his left


Balls faced: 14
Bowler: Mukesh Kumar
Over: 20
Pitch Line: OUTSIDE_OFFSTUMP Length: GOOD_LENGTH
Shot: DEFENDED
Run scored: 0


length ball around off. Defended on the leg side with a vertical bat


Balls faced: 15
Bowler: Mukesh Kumar
Over: 20
Pitch Line: OUTSIDE_OFFSTUMP Length: GOOD_LENGTH
Shot: DEFENDED
Run scored: 0


length ball around off. Defended again


Balls faced: 16
Bowler: Mukesh Kumar
Over: 20
Pitch Line: OUTSIDE_OFFSTUMP Length: GOOD_LENGTH
Shot: DEFENDED
Run scored: 0


length ball around off, defended


Balls faced: 17
Bowler: Mukesh Kumar
Over: 20
Pitch Line: OUTSIDE_OFFSTUMP Length: GOOD_LENGTH
Shot: COVER_DRIVE
Run scored: 0
Finally a break for Siraj. Here's Mukesh

a length ball in the channel and seaming away. Maharaj throws his bat at it and <b>gets beaten</b>


Balls faced: 18
Bowler: Prasidh
Over: 19
Pitch Line: ON_THE_STUMPS Length: GOOD_LENGTH
Shot: FLICK
Run scored: 0


short of length at the batter. Maharaj manages to dab it down behind square leg for one

Legbyes: 1
Balls faced: 19
Bowler: Prasidh
Over: 19
Pitch Line: OUTSIDE_OFFSTUMP Length: SHORT
Shot: PULL
Run scored: 0


a bouncer, angling towards the batter's head. Maharaj goes for the pull but misses


Balls faced: 20
Bowler: Prasidh
Over: 19
Pitch Line: OUTSIDE_OFFSTUMP Length: GOOD_LENGTH
Shot: DEFENDED
Run scored: 0


length ball around off. Defended


Balls faced: 21
Bowler: Mukesh Kumar
Over: 20
Pitch Line: OUTSIDE_OFFSTUMP Length: SHORT_OF_A_GOOD_LENGTH
Shot: PULL
Run scored: 0

Maharaj is OUT! caught
c Bumrah b Mukesh Kumar
Keshav Maharaj c Bumrah b Mukesh Kumar 3 (13b 0x4 0x6 20m) SR: 23.07
<b>Mukesh strikes in his first over.</b> A length ball around off, and Maharaj goes for the pull. But the ball hits high on the bat and lobs towards midwicket where Bumrah accepts the dolly. <b>South Africa 46 for 8</b>


Balls faced: 22
Bowler: Mukesh Kumar
Over: 20
Pitch Line: OUTSIDE_OFFSTUMP Length: GOOD_LENGTH
Shot: SQUARE_DRIVE
Run scored: 0


full around off. Driven towards backward point where Jadeja makes a diving stop to his left


Balls faced: 23
Bowler: Mukesh Kumar
Over: 20
Pitch Line: OUTSIDE_OFFSTUMP Length: GOOD_LENGTH
Shot: DEFENDED
Run scored: 0


length ball around off. Defended on the leg side with a vertical bat


Balls faced: 24
Bowler: Mukesh Kumar
Over: 20
Pitch Line: OUTSIDE_OFFSTUMP Length: GOOD_LENGTH
Shot: DEFENDED
Run scored: 0


length ball around off. Defended again


Balls faced: 25
Bowler: Mukesh Kumar
Over: 20
Pitch Line: OUTSIDE_OFFSTUMP Length: GOOD_LENGTH
Shot: DEFENDED
Run scored: 0


length ball around off, defended


Balls faced: 26
Bowler: Mukesh Kumar
Over: 20
Pitch Line: OUTSIDE_OFFSTUMP Length: GOOD_LENGTH
Shot: COVER_DRIVE
Run scored: 0
Finally a break for Siraj. Here's Mukesh

a length ball in the channel and seaming away. Maharaj throws his bat at it and <b>gets beaten</b>



Match: all_games_1411166_1415716.json
Balls faced: 1
Bowler: van Beek
Over: 18
Pitch Line: OUTSIDE_OFFSTUMP Length: SHORT_OF_A_GOOD_LENGTH
Shot: LEG_GLANCE
Run scored: 0
Maharaj

shorter side of a length, and angling into leg. He clips to fine leg and takes off, but Miller sends Maharaj back


Balls faced: 2
Bowler: van Beek
Over: 18
Pitch Line: OUTSIDE_OFFSTUMP Length: SHORT_OF_A_GOOD_LENGTH
Shot: LEG_GLANCE
Run scored: 0
Maharaj

shorter side of a length, and angling into leg. He clips to fine leg and takes off, but Miller sends Maharaj back



Match: all_games_1411166_1415721.json
Balls faced: 1
Bowler: Rishad Hossain
Over: 19
Pitch Line: OUTSIDE_OFFSTUMP Length: GOOD_LENGTH
Shot: ON_DRIVE
Run scored: 1


Tries the booming cover drive. The line and length were in the batter's favour but the turn meant it went off the edge to short third


Balls faced: 2
Bowler: Rishad Hossain
Over: 19
Pitch Line: OUTSIDE_OFFSTUMP Length: GOOD_LENGTH
Shot: PUSH
Run scored: 0


Full just outside off, pushed to cover. Fielder's close, crowd cheer. Bangladesh closing this innings well
Nasif : "Ekanth don't predict please, you're getting them out" lol

Balls faced: 3
Bowler: Rishad Hossain
Over: 19
Pitch Line: ON_THE_STUMPS Length: GOOD_LENGTH
Shot: PADDLE_SWEEP
Run scored: 2


Paddles the full ball fine


Balls faced: 4
Bowler: Mustafizur
Over: 20
Pitch Line: DOWN_LEG Length: SHORT
Shot: PULL
Run scored: 1


He will have to run this time. Bumper is pulled from just outside off and finds midwicket


Balls faced: 5
Bowler: Mustafizur
Over: 20
Pitch Line: OUTSIDE_OFFSTUMP Length: GOOD_LENGTH
Shot: LEFT_ALONE
Run scored: 0


Maharaj has finally caught up. Leaves the full ball with the sharp angle and the crowd quiet up after a noisy little period. He was standing just outside off but didn't get the bat down due to the angle
ninad: "very poor by sa... they are not even trying to run a single of keeper" Think Maharaj wants strike
Wide: 1
Balls faced: 6
Bowler: Mustafizur
Over: 20
Pitch Line: OUTSIDE_OFFSTUMP Length: GOOD_LENGTH
Shot: SLOG_SHOT
Run scored: 0


Maharaj does go across but still can't make contact. Tried to drag it over midwicket but the fullish ball beat him for pace


Balls faced: 7
Bowler: Mustafizur
Over: 20
Pitch Line: ON_THE_STUMPS Length: SHORT_OF_A_GOOD_LENGTH
Shot: PULL
Run scored: 0


Shortish ball looked pacy and beat the pull. Maharaj went on the front tool and tried heaving over midwicket. Went next to his shoulder


Balls faced: 8
Bowler: Mustafizur
Over: 20
Pitch Line: OUTSIDE_OFFSTUMP Length: GOOD_LENGTH
Shot: SLOG_SHOT
Run scored: 0


Keeps it away from the arc to beat him again. Maharaj tries dragging it across with a splashy heave but didn't move across and the reach wasn't enough. Litton is standing wide off side, so this is bowling to a plan


Balls faced: 9
Bowler: Mustafizur
Over: 20
Pitch Line: OUTSIDE_OFFSTUMP Length: SHORT_OF_A_GOOD_LENGTH
Shot: CUT_SHOT
Run scored: 0
Final over. No predictions

Takes it away, offers no pace and the Fizz beats the cut. Length ball through fifth


Balls faced: 10
Bowler: Rishad Hossain
Over: 19
Pitch Line: OUTSIDE_OFFSTUMP Length: GOOD_LENGTH
Shot: ON_DRIVE
Run scored: 1


Tries the booming cover drive. The line and length were in the batter's favour but the turn meant it went off the edge to short third


Balls faced: 11
Bowler: Rishad Hossain
Over: 19
Pitch Line: OUTSIDE_OFFSTUMP Length: GOOD_LENGTH
Shot: PUSH
Run scored: 0


Full just outside off, pushed to cover. Fielder's close, crowd cheer. Bangladesh closing this innings well
Nasif : "Ekanth don't predict please, you're getting them out" lol

Balls faced: 12
Bowler: Rishad Hossain
Over: 19
Pitch Line: ON_THE_STUMPS Length: GOOD_LENGTH
Shot: PADDLE_SWEEP
Run scored: 2


Paddles the full ball fine


Balls faced: 13
Bowler: Mustafizur
Over: 20
Pitch Line: DOWN_LEG Length: SHORT
Shot: PULL
Run scored: 1


He will have to run this time. Bumper is pulled from just outside off and finds midwicket


Balls faced: 14
Bowler: Mustafizur
Over: 20
Pitch Line: OUTSIDE_OFFSTUMP Length: GOOD_LENGTH
Shot: LEFT_ALONE
Run scored: 0


Maharaj has finally caught up. Leaves the full ball with the sharp angle and the crowd quiet up after a noisy little period. He was standing just outside off but didn't get the bat down due to the angle
ninad: "very poor by sa... they are not even trying to run a single of keeper" Think Maharaj wants strike
Wide: 1
Balls faced: 15
Bowler: Mustafizur
Over: 20
Pitch Line: OUTSIDE_OFFSTUMP Length: GOOD_LENGTH
Shot: SLOG_SHOT
Run scored: 0


Maharaj does go across but still can't make contact. Tried to drag it over midwicket but the fullish ball beat him for pace


Balls faced: 16
Bowler: Mustafizur
Over: 20
Pitch Line: ON_THE_STUMPS Length: SHORT_OF_A_GOOD_LENGTH
Shot: PULL
Run scored: 0


Shortish ball looked pacy and beat the pull. Maharaj went on the front tool and tried heaving over midwicket. Went next to his shoulder


Balls faced: 17
Bowler: Mustafizur
Over: 20
Pitch Line: OUTSIDE_OFFSTUMP Length: GOOD_LENGTH
Shot: SLOG_SHOT
Run scored: 0


Keeps it away from the arc to beat him again. Maharaj tries dragging it across with a splashy heave but didn't move across and the reach wasn't enough. Litton is standing wide off side, so this is bowling to a plan


Balls faced: 18
Bowler: Mustafizur
Over: 20
Pitch Line: OUTSIDE_OFFSTUMP Length: SHORT_OF_A_GOOD_LENGTH
Shot: CUT_SHOT
Run scored: 0
Final over. No predictions

Takes it away, offers no pace and the Fizz beats the cut. Length ball through fifth